问题,答案
情绪反应惯性中自卑、悲观模式，人类普遍是多少,量化数据：人类普遍60-80%。自卑对人类的影响很大。大多数人都看起来开朗自信，其实自卑感都藏在心里，不表露于人，自己也尽量去逃避。数值在80%左右的，就已经可以明显影响到自己的整体心态，给生活带来阻碍。 
情绪反应惯性中自负、傲慢模式，人类平均是多少,量化数据：人类平均80%。比自卑数值稍高。因为人们急于想摆脱自卑，便会不停的制造各种有利于自己的比较，来抬高自己，去鄙视别人。
流动性方面中的思想惯性流动性，量化数据的数值是多少,人类平均40%。
流动性方面中的情绪惯性流动性，量化数据的数值是多少,人类大部分30-60%。
流动性方面中的惯性阈限流动性，量化数据的数值是多少,人类平均60%
流动性方面中的惯性核心流动性，量化数据的数值是多少,人类平均60%。
流动性方面中的单一惯性流动性，量化数据的数值是多少,人类大部分40-60%。
流动性方面中的多惯性组合流动性，量化数据的数值是多少,人类普遍60-80%。
流动性方面中的浅层惯性流动性，量化数据的数值是多少,人类普遍30-60%。
流动性方面中的中层惯性流动性，量化数据的数值是多少,人类普遍20-50%。
流动性方面中的深层惯性流动性，量化数据的数值是多少,人类普遍10-20%。
延展性方面里边的延展稳定性，量化数据是？,人类大部分20-50%。
延展性方面里边的延展范围性，量化数据是？,人类普遍60-80%。
延展性方面里边的延展灵活性，量化数据是？,人类普遍30-60%。
延展性方面里边的延展深度性，量化数据是？,人类普遍60-80%。
延展性方面里边的延展细化性，量化数据是？,人类普遍30-80%。
延展性方面里边的延展差异性，量化数据是？,人类大部分60-80%。
分化性方面中的分化稳定性，量化数据是多少,人类大部分60-80%。
分化性方面中的分化细致性，量化数据是多少,人类平均60%。
分化性方面中的分化弱化性，量化数据是多少,人类大部分20-30%，小惯性会因自然发展而逐渐弱化。
分化性方面中的分化组合性，量化数据是多少,人类平均80%。
分化性方面中的分化流动性，量化数据是多少,人类大部分20-60%。
分化性方面中的分化柔和性，量化数据是多少,人类大部分40-60%。
原发保留程度下分小点：数量原发程度的量化数据是多少,人类大部分60-80%。
原发保留程度下分小点：形态原发程度的量化数据是多少,人类大部分30-60%。
原发保留程度下分小点：品质原发程度的量化数据是多少,人类平均60%。
原发保留程度下分小点：循环原发程度的量化数据是多少,人类大部分60-80%。
继发程度下分的数量继发程度，量化数据是多少,人类大部分30-60%。
继发程度下分的形态继发程度，量化数据是多少,人类大部分40-60%。
继发程度下分的品质继发程度，量化数据是多少,人类大部分30-60%。
继发程度下分的循环继发程度，量化数据是多少,人类大部分30-40%
诱导性的影响程度中，心智程序的影响人类大部分是多少,量化数据：人类大部分60-80%。
诱导性的影响程度中，催眠波的影响人类平均是多少,量化数据：人类平均80-90%。
诱导性的影响程度中，催眠植入物的影响人类平均是多少,量化数据：人类平均60%。
诱导性的影响程度中，其它功能植入物的影响人类大部分是多少,量化数据：人类大部分30-60%。
诱导性的影响程度中，影响的深度人类大部分是多少,量化数据：人类大部分60-80%。
诱导性的影响程度中，影响的广度人类平均是多少,量化数据：人类平均80-90%。
诱导性的影响程度中，影响的强度人类平均是多少,量化数据：人类平均60%。
诱导性的影响程度中，影响的变异度人类平均是多少,量化数据：人类平均60%。
诱导性的影响程度中，诱导手段的统合性人类大部分是多少,量化数据：人类大部分40-60%。
心智程序有可能是怎么带来的,有可能是今生程序设定以及环境影响带来
今生程序设定以及环境影响带来的心智程序中，对自己产生意识惯性的部分。这个解释是指什么,左方区：旧有惯性区的心智惯性部分
人类的思维模式都和什么有关,人类的思维模式都和观念有关，总是遵循一些特定的观点和信念。
思维惯性是指个体在思考过程中的倾向和惯性。对吗,对
心智模式对人类思维惯性的影响，普遍在多少左右,普遍在60%左右。
传统观念是由什么传承下来的？,由国家、民族、地区等历史传承下来的
什么检测点其实是换汤不换药，和传统观念没多大区别，只是更新一部分标准，继续束缚人类而已。  ,思维惯性中的社会舆论的影响
和社会洗脑体系是一体的是什么,社会舆论的影响
当前社会下的形势和舆论导向，会创建适应当前社会的新观念、新标准，被个体吸收或归纳到原有思维体系中去，成为新的意识惯性。  这个是指哪个检测点？,思维惯性中的社会舆论的影响
让人类以为社会在发展，观念在更新在进步的假象这个是社会洗脑体系，对吗？,对
社会舆论影响方面，T组的催眠策略是什么,让人类以为社会在发展，观念在更新在进步的假象。之前的标准，人类受不了了，就进行更新，推出新的升级版，宣传这是更科学、更合理、更人性化的标准，这是社会进步的标志……等等。 
在历史上，T组会根据人类新的觉醒趋势，随时更新出“新标准”。目前什么情况,目前，新标准很快就要推出，已经有一些类似的在传播了。新的整套标准非常棒，听起来十分振奋人心，简直是人类里程碑般的发展。新标准的升级，目前还没有完全成型，还在逐步完善中。
怎么破解社会舆论的影响中T组将要推出的“新标准”？,破解方法：觉察自己把哪些灵性的东西拿去衡量别人、评判别人、绑架别人。
学校会宣扬或倡导某些理想化观念和行为规范，提倡学生们去遵守和执行。这个是哪个检测点？,思维惯性中学校教育的影响
大部分学校的教导都会在社会中慢慢淡化，基本上只有百分之多少左右的核心内容，能被学生们所真正消化和纳入思想体系中。,基本上只有20-40%左右，其实这样的比例，对于教育洗脑来说，已经足够了。 
学校教育的影响，也有国家差异，发达国家40%左右。为什么发达国家数值更高？,发达国家注重素质教育，学生被灌输的标准和理念很多。
人生新阶段的变化有哪些,工作、结婚、生子、养老等等
个体突发转折事件会给个体心态造成一定冲击，也会影响先前固有的思维方式和观念。   那么转折之后一般会如何做,转折之后，个体会抛弃一部分旧有观念，去寻求一些适合自己状况的新观念，进行补充。   
行为反应惯性是指个体遇到事件时，受心智程序所影响的惯性行为反应。对吗,对
"意识强度检测点5区的检测点有哪些是""换汤不换药""",1、社会舆论的影响和传统观念的影响是换汤不换药，和传统观念没多大区别，只是更新一部分标准，继续束缚人类而已。  2、创新型反应模式，指个体在原有观念不变的情况下，为了自身利益，而去改变自己的应对方式。   产生新的应对方式后，个体会感觉自己像是改变了，变得更加成熟。这种模式很具有迷惑性，其实也是换汤不换药。3、T组催眠策略之一：把人类的关注点，放在通过不同的“行为模式”，去达成自己的目的。这种催眠模式也在心理学领域中存在影响：让人们以为自己突破了固化观念，发展了创新，其实只是学习了更多自我催眠的方法和技巧，本质上还是换汤不换药。
换汤不换药像什么,也像一个人整天换新衣服，却不洗澡。
创新型反应模式中T组催眠策略是什么,T组催眠策略之一：把人类的关注点，放在通过不同的“行为模式”，去达成自己的目的。   这方面的洗脑文章非常多，教导人们用各种技巧和手段，来维护自己固有的观念，达成相应的目的。
T组催眠策略之一：把人类的关注点，放在通过不同的“行为模式”，去达成自己的目的。这个催眠策略是什么模式,这个催眠策略是尽量覆盖多角度，从多角度围攻的模式。
绝望型反应模式举例,例如：患绝症，一些人的观念会认为，这时候应该享受生活。另一些人的观念会认为，这时候应该继续医治，死马当活马医。还有一些的观念会认为，这时候要报复社会...等等。   其它情况也有很多，比如离别、破产、打官司或者环境影响等等。事件越重大，头脑心智对个体的影响就越小。不那么严重的时候，个体多半还会采取头脑处理模式。    
解释绝望型反应模式,指个体遇到某些事件，无法采取任何主动的应对措施来改变状况，只能被动接受，在绝望状态下采取的反应行为。该反应和心智模式相关，也是属于个体观念系统中的，认为在此情况下，自己应该如何做。   
情绪反应惯性解释,指个体在事件中认为自己应该有的正当情绪。 
情绪反应惯性举例,比如：有人说自己坏话，自己就应该愤怒。有人要离开，自己应该不舍。看到别人受苦，自己应该难受等等。   人的情绪，有时候也会被心智操控，确实产生了自己认为应该有的情绪。   主要原理是靠头脑去识别、判定事件的性质，来激发自身相应的情绪模式。  例如：将一件事情识别为是对自己的冒犯，那么自己就会愤怒。 人类很多情绪，都是受这种头脑虚假识别所带来的。   这种也是属于催眠策略之一。 有一些在挑拨人与人之间的关系。比如：会有很多文章不停的教你，对方的这种行为的真实含义是什么，是在暗示什么，是在表达什么。一些行为你没有意识到，其实你被冒犯了，被越界了等等，个体看到后会感觉恍然大悟。其实，不说的话，自己也丝毫没有察觉。现在甚至连一个表情，一个词语，你都被告知真实含义都是对方不爱理你等等。这是一种有效的催眠策略，一种灌输方式，并且随着时代变化在不断更新升级。（这里面大有文章。有兴趣的人，可以专门做一个研究课题。）
人类很多情绪，都是受这种头脑虚假识别所带来的。  这是催眠策略吗,这种也是属于催眠策略之一。
现在甚至连一个表情，一个词语，你都被告知真实含义都是对方不爱理你等等。这是催眠策略吗,这是一种有效的催眠策略，一种灌输方式，并且随着时代变化在不断更新升级。
人的情绪，有时候也会被心智操控，确实产生了自己认为应该有的情绪。主要原理是什么,主要原理是靠头脑去识别、判定事件的性质，来激发自身相应的情绪模式。
意识强度检测点5区有哪些催眠策略,1、社会舆论的影响，和社会洗脑体系是一体的：让人类以为社会在发展，观念在更新在进步的假象。这个也是T组*催眠策略之一：之前的标准，人类受不了了，就进行更新，推出新的升级版，宣传这是更科学、更合理、更人性化的标准，这是社会进步的标志……等等。2、创新型反应模式，这个也是T组催眠策略之一：把人类的关注点，放在通过不同的“行为模式”，去达成自己的目的。   这方面的洗脑文章非常多，教导人们用各种技巧和手段，来维护自己固有的观念，达成相应的目的。这个催眠策略是尽量覆盖多角度，从多角度围攻的模式。3、情绪反应惯性，例如：将一件事情识别为是对自己的冒犯，那么自己就会愤怒。 人类很多情绪，都是受这种头脑虚假识别所带来的。   这种也是属于催眠策略之一。 现在甚至连一个表情，一个词语，你都被告知真实含义都是对方不爱理你等等。这是一种有效的催眠策略，一种灌输方式，并且随着时代变化在不断更新升级。
意识强度检测点5区中，哪些检测点建议可以专门做研究课题,情绪反应惯性、多惯性组合流动性、延展差异性、分化细致性
传统观念和社会标准中，已经让人们把一些特定事件识别为自己应该自责和内疚的，都是自己的错。这个是哪个检测点,第5区左方区：旧有惯性区，心智惯性部分，情绪反应惯性中的内疚、自责模式。
哪种情绪构成很复杂，但激发却很简单。是情绪操控中常用的手段之一。  ,嫉妒模式：由于比较，自己无法达到社会平均标准，对达标或者高于社会标准的个体，会产生敌视感。
该情绪属于容易陷进去，不容易拔出来。并且可以长期稳定地存在于个体中，持续对人造成影响。类似定时炸弹，是引发连锁负面情绪很好用的导火线。是什么情绪,嫉妒
羞愧这种情绪会降低自信心，造成人际关系的问题。对吗,对
在一些场合中认为自己表现不当，让人感到尴尬和困窘，会让自己难以忘怀，感觉丢人。是哪个检测点,羞愧模式。
恐惧、害怕模式。举例,比如怕黑、怕鬼、怕人借钱等等。
解释恐惧、害怕模式,受一些观念所影响，认为某些场景应该是很让人害怕的，所以自己会预先产生恐惧的心理。
意识强度检测点5区中，有一个点是心智容易控制的地方，哪个点,自卑、悲观模式，对人事物的看法较为消极，多数和自卑有关，对自我评价较低。人类基本都有感到自卑的地方。因为人无完人，这一点也是心智容易控制的地方。
自卑、悲观模式的控制模式,不断去通过各种比较，来强化个体的“弱点”，让人不自信，觉得自己不行，以此打击个体。
哪个情绪对人类的影响很大。,自卑
大多数人都看起来开朗自信，其实自卑感都藏在心里，不表露于人，自己也尽量去逃避。这个说的是哪个检测点,自卑、悲观模式
数值在多少左右的，就已经可以明显影响到自己的整体心态，给生活带来阻碍。 ,80%左右
与自卑属于一对数值，互相同时影响个体。哪个数值,自负、傲慢模式。
当个体自卑的时候就想通过什么去进行心态调节。,自负
意识强度检测点5区的情绪反应惯性中，属于两个极端，让人无法达成真正的平衡。是指哪两个检测点？,自卑、悲观模式和自负、傲慢模式
为什么自负、傲慢模式的量化数值比自卑、悲观模式稍高,自负比自卑数值稍高。因为人们急于想摆脱自卑，便会不停的制造各种有利于自己的比较，来抬高自己，去鄙视别人。 
潜意识惯性流动性慢的话，代表啥,潜意识惯性流动性慢的话，代表该惯性较为固化。
潜意识惯性流动性快的话，代表啥,流动快，说明比较灵活一些。
潜意识惯性流动性如果百分百的话，代表什么,如果百分百的话，代表没有任何阻碍，可随意切换，属于没有任何相关的惯性。
思想惯性流动性解释,个体从一种思想形态切换到另一种的速度。
个体从一种思想形态切换到另一种的速度，切换快代表什么,切换快，代表思维较为灵活。
个体从一种思想形态切换到另一种的速度，切换慢代表什么,慢的话，代表该个体较为思想固执，不太会变通。
情绪惯性流动性数值高会怎样,数值高的话，情绪调节能力强，可适应各种压力环境。
情绪惯性流动性数值低会怎样,数值低的话，就较难排解自己的负面情绪，容易长期受影响。
惯性阈限值较为灵活的会怎样,惯性阈限值较为灵活的，人会比较灵活变通，适应各种情况；
惯性阈限值较为死板的会怎样,惯性阈限值如果较为死板，代表该人过于坚守自己的原则，较难针对形势做一些调整。
惯性核心流动性什么意思,指个体一些较为核心惯性的变化程度。
惯性核心流动性高会怎样,流动性高，不会固执己见，能接受不同的观点思想
惯性核心流动性数值低会怎样,数值低，则相当保守，无法接受新理念。
单一惯性流动性解释一下,指个体在保有一种惯性的同时，对该惯性相关的观念和情绪等的流动性。
单一惯性流动性强代表什么,流动性强，代表该惯性具有伸缩性，可大可小。
多惯性组合流动性，解释一下,指个体根据当下的不同情况，自动对相关的惯性倾向进行不同的组合，来应对各种状况。
意识强度检测点5区中，什么也是人类性格复杂多变的因素之一,多惯性组合流动性：这些组合灵活多变，表现多种多样，也是人类性格复杂多变的因素之一。
意识强度检测点5区中，哪种意识惯性，与复合体深度无关,浅层意识惯性
什么是浅层意识惯性的一部分来源,中层意识惯性和深层意识惯性
什么是中层意识惯性的一部分来源,深层意识惯性
什么意识惯性是个体较为深入的一些性格的来源。,中层意识惯性
延展性方面，延展性越强代表什么,延展性越强，代表该惯性对个体的影响就越突出。
延展性方面这个检测点指什么,指单一潜意识惯性能够扩展到多大范围。
解释延展稳定性,指该惯性在延展过程中，保持强度和倾向不变的程度。很多惯性，在延展中还是会发生一些变化。
延展稳定性数值高代表什么,数值高，代表该人极其单一古板。
分化细致性解释一下,指该惯性根据细化程度，可分成多少小的惯性。
在意识强度检测点5区中，很多修行的人看起来比普通人限制更多的原因是什么,分化细致性：修行者在一定阶段，觉察层面较为精细，惯性自动分化的也更加细致，在更多灵性方面影响修行者。这个也是很多修行的人看起来比普通人限制更多的原因之一。
心智系统常常结合这一点，对个体进行配合控制，加强惯性。这一点指什么,指分化细致性：修行者在一定阶段，觉察层面较为精细，惯性自动分化的也更加细致，在更多灵性方面影响修行者。这个也是很多修行的人看起来比普通人限制更多的原因之一。
分化柔和性数值很高的个体会怎样,数值很高的个体，会觉得该惯性组合让自己感到舒适。
分化更加自然隐蔽，也是催眠大趋势之一。对吗,对
循环原发程度数值是指什么,该数值是指：今生先天惯性中，有多少是由于需要循环的原因而被保留。
意识强度检测点5区中，哪方面常有T组的各种合作方来进行实验,影响的变异度：诱导性手段对潜意识惯性产生变异的影响，由一种惯性向另一种惯性进行成功诱导的比例。这方面常有T组的各种合作方来进行实验。
